{
  "$id": "https://example.invalid/px4-planner/vehicle-model-v1.schema.json",
  "$schema": "https://json-schema.org/draft/2020-12/schema",
  "additionalProperties": false,
  "properties": {
    "configuration": {
      "maxLength": 256,
      "minLength": 1,
      "type": "string"
    },
    "identified_for_physical_flight": {
      "type": "boolean"
    },
    "mass_kg": {
      "description": "All-up modeled mass.",
      "exclusiveMinimum": 0,
      "type": "number"
    },
    "maximum_acceleration_m_s2": {
      "description": "Verified translational acceleration ceiling.",
      "exclusiveMinimum": 0,
      "type": "number"
    },
    "maximum_body_rate_deg_s": {
      "description": "Verified body-rate ceiling.",
      "exclusiveMinimum": 0,
      "type": "number"
    },
    "maximum_jerk_m_s3": {
      "description": "Verified translational jerk ceiling.",
      "exclusiveMinimum": 0,
      "type": "number"
    },
    "maximum_speed_m_s": {
      "description": "Verified model speed ceiling.",
      "exclusiveMinimum": 0,
      "type": "number"
    },
    "maximum_thrust_n": {
      "description": "Maximum modeled collective thrust.",
      "exclusiveMinimum": 0,
      "type": "number"
    },
    "maximum_tilt_deg": {
      "description": "Verified body tilt ceiling.",
      "exclusiveMinimum": 0,
      "type": "number"
    },
    "maximum_yaw_acceleration_deg_s2": {
      "description": "Verified yaw-acceleration ceiling, at or below the controller limit.",
      "exclusiveMinimum": 0,
      "type": "number"
    },
    "maximum_yaw_jerk_deg_s3": {
      "description": "Verified yaw-jerk ceiling, at or below the controller limit.",
      "exclusiveMinimum": 0,
      "type": "number"
    },
    "maximum_yaw_rate_deg_s": {
      "description": "Verified yaw-rate ceiling, at or below the controller limit.",
      "exclusiveMinimum": 0,
      "type": "number"
    },
    "minimum_thrust_n": {
      "description": "Minimum modeled collective thrust.",
      "minimum": 0,
      "type": "number"
    },
    "rotor_thrust_maximum_n": {
      "description": "Maximum thrust of one rotor.",
      "exclusiveMinimum": 0,
      "type": "number"
    },
    "rotor_thrust_minimum_n": {
      "description": "Minimum thrust of one rotor.",
      "minimum": 0,
      "type": "number"
    },
    "schema_version": {
      "const": 1
    },
    "vehicle_model_id": {
      "pattern": "^[A-Za-z0-9][A-Za-z0-9._:-]{0,127}$",
      "type": "string"
    },
    "yaw_inertia_kg_m2": {
      "description": "Yaw inertia used for the paired-rotor torque check.",
      "exclusiveMinimum": 0,
      "type": "number"
    },
    "yaw_torque_per_thrust_m": {
      "description": "Yaw torque produced per unit rotor thrust.",
      "exclusiveMinimum": 0,
      "type": "number"
    }
  },
  "required": [
    "schema_version",
    "vehicle_model_id",
    "configuration",
    "mass_kg",
    "maximum_speed_m_s",
    "maximum_acceleration_m_s2",
    "maximum_jerk_m_s3",
    "maximum_yaw_rate_deg_s",
    "maximum_yaw_acceleration_deg_s2",
    "maximum_yaw_jerk_deg_s3",
    "maximum_tilt_deg",
    "maximum_body_rate_deg_s",
    "minimum_thrust_n",
    "maximum_thrust_n",
    "rotor_thrust_minimum_n",
    "rotor_thrust_maximum_n",
    "yaw_inertia_kg_m2",
    "yaw_torque_per_thrust_m",
    "identified_for_physical_flight"
  ],
  "title": "VehicleModel v1",
  "type": "object"
}
